{
  "status": "dirty",
  "dirty_files": [
    "node .opencode/scripts/framework-self-test.js",
    "npx tsx .opencode/scripts/framework-self-test.ts",
    "bun .opencode/scripts/framework-self-test.ts",
    "/home/zhaoge/workspace/opencode/work-one/.opencode/scripts/framework-self-test.ts",
    "/home/zhaoge/workspace/opencode/work-one/.opencode/plugins/tdd-before.ts",
    "/home/zhaoge/workspace/opencode/work-one/.opencode/plugins/gate-before.ts",
    "/home/zhaoge/workspace/opencode/work-one/.opencode/plugins/tdd-after.ts",
    "/home/zhaoge/workspace/opencode/work-one/booking_system_refactor/booking-backend/src/modules/test-tdd/test.service.ts",
    "/home/zhaoge/workspace/opencode/work-one/.opencode/tools/knowledge_cache_search.ts",
    "/home/zhaoge/workspace/opencode/work-one/.opencode/lib/uc7ks-utils.ts",
    "/home/zhaoge/workspace/opencode/work-one/.opencode/scripts/mcp-tools/compliance-gate.ts",
    "/home/zhaoge/workspace/opencode/work-one/.opencode/plugins/dispatch-before.ts",
    "/home/zhaoge/workspace/opencode/work-one/.opencode/scripts/state-reconciliation.ts",
    "/home/zhaoge/workspace/opencode/work-one/.opencode/scripts/nightly-compaction.ts",
    "/home/zhaoge/workspace/opencode/work-one/.opencode/lib/tolerant-json.ts",
    "/home/zhaoge/workspace/opencode/work-one/.opencode/plugins/json-validate.ts",
    "/home/zhaoge/workspace/opencode/work-one/.opencode/scripts/command-tools/dispatch-subagent.ts",
    "/home/zhaoge/workspace/opencode/work-one/.opencode/tools/module_scope_declare.ts",
    "ls booking_system_refactor/booking-backend/prisma/schema.prisma 2>/dev/null && head -5 booking_system_refactor/booking-backend/prisma/schema.prisma",
    "head -20 /home/zhaoge/workspace/opencode/work-one/.opencode/scripts/framework-self-test.ts",
    "wc -l /home/zhaoge/workspace/opencode/work-one/.opencode/lib/log-manager.ts",
    "echo \"=== compliance-gate.ts top 20 lines ===\" && head -20 .opencode/scripts/mcp-tools/compliance-gate.ts && echo \"\" && echo \"=== eslint-audit.ts top 20 lines ===\" && head -20 .opencode/scripts/mcp-tools/eslint-audit.ts && echo \"\" && echo \"=== code-quality-gate.ts top 20 lines ===\" && head -20 .opencode/scripts/mcp-tools/code-quality-gate.ts",
    "grep -n \"_gateCore\" .opencode/scripts/mcp-tools/compliance-gate.ts",
    "sed -n '110,130p' .opencode/scripts/mcp-tools/compliance-gate.ts",
    "grep -n \"_gateCore\\|require(\" .opencode/scripts/mcp-tools/compliance-gate.ts",
    "grep -n \"getEnforcementMode()\" .opencode/scripts/mcp-tools/compliance-gate.ts",
    "grep -n \"_gateCore\\|require(.*child_process\\|require(.*state-compactor\" .opencode/scripts/mcp-tools/compliance-gate.ts",
    "grep -n \"_gateCore\\|require(.*child_process\\|require(.*compactor\" .opencode/scripts/mcp-tools/compliance-gate.ts",
    "grep -n \"require(\" .opencode/scripts/mcp-tools/compliance-gate.ts",
    "/home/zhaoge/workspace/opencode/work-one/.opencode/lib/gate-core.ts",
    "tail -20 .opencode/scripts/state-transaction.ts",
    "tail -10 .opencode/scripts/mcp-tools/compliance-gate.ts",
    "git checkout -- .opencode/scripts/mcp-tools/compliance-gate.ts",
    "echo \"=== gate-core.ts BUN-CACHE-VERSION ===\" && head -4 .opencode/lib/gate-core.ts && echo \"\" && echo \"=== compliance-gate.ts top 30 ===\" && head -30 .opencode/scripts/mcp-tools/compliance-gate.ts",
    "cd /home/zhaoge/workspace/opencode/work-one && head -20 .opencode/scripts/mcp-tools/eslint-audit.ts",
    "cat > /tmp/check_mode.js << 'SCRIPT'\nconst path = require('path');\nconst fs = require('fs');\nconst cfgPath = path.join('/home/zhaoge/workspace/opencode/work-one', '.opencode', 'project.config.json');\nconsole.log('cfgPath:', cfgPath);\nconsole.log('exists:', fs.existsSync(cfgPath));\ntry {\n  const cfg = JSON.parse(fs.readFileSync(cfgPath, 'utf8'));\n  const tr = cfg.template_resolution;\n  console.log('develop_enforcement_mode:', tr?.develop_enforcement_mode);\n  console.log('runtime_enforcement_mode:', tr?.runtime_enforcement_mode);\n  const mode = tr?.develop_enforcement_mode || tr?.runtime_enforcement_mode;\n  console.log('RESOLVED:', mode);\n} catch(e) {\n  console.log('ERROR:', e.message);\n}\nSCRIPT\nnode /tmp/check_mode.js",
    "cat > /tmp/test_mode.js << 'ENDOFSCRIPT'\nvar path = require('path');\nvar fs = require('fs');\nvar rootDir = path.resolve(__dirname || '/home/zhaoge/workspace/opencode/work-one', '.');\nvar cfgPath = path.join(rootDir, '.opencode', 'project.config.json');\nvar configMode = 'advisory';\ntry {\n  if (fs.existsSync(cfgPath)) {\n    var raw = fs.readFileSync(cfgPath, 'utf8');\n    var cfg = JSON.parse(raw);\n    var tr = cfg.template_resolution;\n    var mode = (tr && tr.develop_enforcement_mode) || (tr && tr.runtime_enforcement_mode);\n    if (mode && ['advisory','strict','locked'].indexOf(mode) >= 0) {\n      configMode = mode;\n    }\n  } else {\n    console.log('cfgPath NOT FOUND:', cfgPath);\n  }\n} catch(e) {\n  console.log('ERROR:', e.message);\n  console.log('cfgPath was:', cfgPath);\n}\nconsole.log('RESULT:', configMode);\nENDOFSCRIPT\nnode /tmp/test_mode.js",
    "cat > /tmp/test_mode2.js << 'ENDOFSCRIPT'\nvar path = require('path');\nvar fs = require('fs');\nvar rootDir = '/home/zhaoge/workspace/opencode/work-one';\nvar cfgPath = path.join(rootDir, '.opencode', 'project.config.json');\nvar configMode = 'advisory';\ntry {\n  if (fs.existsSync(cfgPath)) {\n    var raw = fs.readFileSync(cfgPath, 'utf8');\n    var cfg = JSON.parse(raw);\n    var tr = cfg.template_resolution;\n    var mode = (tr && tr.develop_enforcement_mode) || (tr && tr.runtime_enforcement_mode);\n    if (mode && ['advisory','strict','locked'].indexOf(mode) >= 0) {\n      configMode = mode;\n    }\n  } else {\n    console.log('cfgPath NOT FOUND:', cfgPath);\n  }\n} catch(e) {\n  console.log('ERROR:', e.message);\n}\nconsole.log('RESULT:', configMode);\nENDOFSCRIPT\nnode /tmp/test_mode2.js",
    "cat > /tmp/jsoncheck.js << 'SCRIPT'\nvar fs = require('fs');\nvar raw = fs.readFileSync('/home/zhaoge/workspace/opencode/work-one/.opencode/project.config.json', 'utf8');\ntry { JSON.parse(raw); console.log('VALID'); } catch(e) { \n  var lineNum = (e.message.match(/position (\\d+)/) || [])[1];\n  if (lineNum) {\n    var pos = parseInt(lineNum);\n    var start = Math.max(0, pos - 50);\n    var end = Math.min(raw.length, pos + 50);\n    console.log('ERROR at position', pos);\n    console.log('CONTEXT:', JSON.stringify(raw.substring(start, end)));\n  }\n  console.log('MESSAGE:', e.message);\n}\nSCRIPT\nnode /tmp/jsoncheck.js",
    "cat > /tmp/find_bad_json.js << 'SCRIPT'\nvar fs = require('fs');\nvar raw = fs.readFileSync('/home/zhaoge/workspace/opencode/work-one/.opencode/project.config.json', 'utf8');\ntry {\n  JSON.parse(raw);\n  console.log('VALID');\n} catch(e) {\n  var m = e.message.match(/position (\\d+)/);\n  if (m) {\n    var pos = parseInt(m[1]);\n    var lineNum = raw.substring(0, pos).split('\\n').length;\n    var colNum = pos - raw.lastIndexOf('\\n', pos - 1);\n    console.log('Error at line', lineNum, 'column', colNum, 'position', pos);\n    var context = raw.substring(Math.max(0, pos - 30), Math.min(raw.length, pos + 30));\n    console.log('Context:', JSON.stringify(context));\n  }\n  console.log('Full error:', e.message);\n}\nSCRIPT\nnode /tmp/find_bad_json.js",
    "cat > /tmp/find_bad_json2.js << 'SCRIPT'\nvar fs = require('fs');\nvar raw = fs.readFileSync('/home/zhaoge/workspace/opencode/work-one/.opencode/project.config.json', 'utf8');\nvar lines = raw.split('\\n');\n// Try to find the invalid line by parsing subsets\nfor (var i = 0; i < lines.length; i++) {\n  try {\n    // Try parsing first i lines\n    var subset = lines.slice(0, i+1).join('\\n');\n    JSON.parse(subset);\n  } catch(e) {\n    // Found the problematic area\n    var j = i;\n    for (; j < lines.length; j++) {\n      try {\n        JSON.parse(lines.slice(0, j+1).join('\\n'));\n        break;\n      } catch(e2) {}\n    }\n    console.log('Problem area around line', (i-1), 'to', j);\n    for (var k = Math.max(0, i-3); k <= Math.min(lines.length-1, j+1); k++) {\n      console.log(k+1 + ':', lines[k]);\n    }\n    break;\n  }\n}\nSCRIPT\nnode /tmp/find_bad_json2.js",
    "cat > /tmp/hexcheck.js << 'SCRIPT'\nvar fs = require('fs');\nvar buf = fs.readFileSync('/home/zhaoge/workspace/opencode/work-one/.opencode/project.config.json');\n// Check first 10 bytes\nconsole.log('First 10 bytes:', Array.from(buf.slice(0,10)).map(b => b.toString(16)).join(' '));\nconsole.log('Length:', buf.length);\n// Check if BOM present\nif (buf[0] === 0xEF && buf[1] === 0xBB && buf[2] === 0xBF) console.log('BOM: YES');\nelse console.log('BOM: NO');\n// Try parsing with clean content\nvar str = buf.toString('utf8');\n// Check for null bytes\nvar nullPos = str.indexOf('\\0');\nif (nullPos >= 0) console.log('NULL BYTE at position', nullPos);\nelse console.log('No null bytes');\nSCRIPT\nnode /tmp/hexcheck.js",
    "cp /home/zhaoge/workspace/opencode/work-one/.opencode/project.config.json /tmp/pcfg.json && cat > /tmp/parse.js << 'SCRIPT'\nvar fs = require('fs');\nvar json = fs.readFileSync('/tmp/pcfg.json', 'utf8');\ntry { JSON.parse(json); console.log('PARSE OK'); } \ncatch(e) { \n  console.log('PARSE FAILED');\n  // Binary search for error position\n  var lo = 0, hi = json.length;\n  while (hi - lo > 1) {\n    var mid = Math.floor((lo + hi) / 2);\n    try { JSON.parse(json.substring(0, mid)); lo = mid; }\n    catch(e2) { hi = mid; }\n  }\n  console.log('Error around byte', hi);\n  var ctx = json.substring(Math.max(0, hi-40), Math.min(json.length, hi+40));\n  console.log('Context:', JSON.stringify(ctx));\n  // Find line number\n  var lineNum = json.substring(0, hi).split('\\n').length;\n  console.log('Line:', lineNum);\n}\nSCRIPT\nnode /tmp/parse.js",